{
  "$schema": "https://json-schema.org/draft/2020-12/schema",
  "title": "Harness Generic Agent Result Artifact",
  "type": "object",
  "required": [
    "run_id",
    "job_id",
    "agent",
    "adapter",
    "status",
    "summary",
    "findings",
    "evidence",
    "not_tested",
    "residual_risks",
    "generated_at"
  ],
  "properties": {
    "run_id": { "type": "string", "minLength": 1 },
    "job_id": { "type": "string", "minLength": 1 },
    "agent": { "type": "string", "minLength": 1 },
    "adapter": { "type": "string", "minLength": 1 },
    "status": {
      "type": "string",
      "enum": [
        "passed",
        "findings",
        "failed",
        "timeout",
        "cancelled",
        "schema_invalid",
        "not_available"
      ]
    },
    "summary": { "type": "string", "minLength": 1 },
    "findings": {
      "type": "array",
      "items": {
        "type": "object",
        "required": ["severity", "title", "evidence", "recommendation"],
        "properties": {
          "severity": {
            "type": "string",
            "enum": ["info", "low", "medium", "high", "critical"]
          },
          "title": { "type": "string", "minLength": 1 },
          "evidence": { "type": "string", "minLength": 1 },
          "recommendation": { "type": "string", "minLength": 1 },
          "file": { "type": "string", "minLength": 1 },
          "line": { "type": "integer", "minimum": 1 }
        },
        "additionalProperties": false
      }
    },
    "evidence": {
      "type": "array",
      "items": {
        "type": "object",
        "required": ["path", "description"],
        "properties": {
          "path": { "type": "string", "minLength": 1 },
          "description": { "type": "string", "minLength": 1 }
        },
        "additionalProperties": false
      }
    },
    "not_tested": {
      "type": "array",
      "items": { "type": "string", "minLength": 1 }
    },
    "residual_risks": {
      "type": "array",
      "items": { "type": "string", "minLength": 1 }
    },
    "generated_at": {
      "type": "string",
      "minLength": 1,
      "format": "date-time",
      "pattern": "^\\d{4}-\\d{2}-\\d{2}T\\d{2}:\\d{2}:\\d{2}(?:\\.\\d+)?(?:Z|[+-]\\d{2}:\\d{2})$"
    }
  },
  "additionalProperties": false
}
