{
  "run_id": "2026-06-22-phase-6-scheduler-watch-mode",
  "job_id": "phase6-watch-agent",
  "agent": "generic-cli-agent",
  "adapter": "generic-cli-agent",
  "status": "passed",
  "summary": "Phase 6 scheduler watch smoke completed.",
  "findings": [],
  "evidence": [
    {
      "path": "jobs/phase6-watch-agent/raw.log",
      "description": "Raw stdout and stderr captured from the watch-executed smoke agent."
    }
  ],
  "not_tested": [
    "Multi-worker claim locking",
    "Automatic stale-running recovery",
    "Cloud queue execution",
    "Cross-run queue execution"
  ],
  "residual_risks": [
    "Heartbeat observational only",
    "Stop cooperative and does not interrupt running jobs",
    "Double-claim risk remains"
  ],
  "generated_at": "2026-06-22T05:22:55Z"
}
