{
  "run_id": "2026-06-22-phase-5-live-scheduler-smoke",
  "job_id": "phase5-live-scheduler-agent",
  "agent": "generic-cli-agent",
  "adapter": "generic-cli-agent",
  "status": "passed",
  "summary": "Local scheduler smoke job executed through run-scheduler --once.",
  "findings": [],
  "evidence": [
    {
      "path": "jobs/phase5-live-scheduler-agent/raw.log",
      "description": "Captured stdout from the scheduler-executed smoke agent."
    }
  ],
  "not_tested": [
    "watch mode",
    "multi-worker concurrency",
    "cloud queue",
    "stale-running recovery",
    "orphaned running jobs"
  ],
  "residual_risks": [
    "Watch mode was not exercised.",
    "Multi-worker concurrency was not exercised.",
    "Cloud queue behavior was not exercised.",
    "Automatic stale-running recovery was not exercised.",
    "Orphaned running jobs are skipped, not recovered."
  ],
  "generated_at": "2026-06-21T23:28:29Z"
}
