{
  "run_id": "2026-06-21-phase-4-live-generic-agent-smoke",
  "job_id": "phase4-live-generic-agent",
  "agent": "generic-cli-agent",
  "adapter": "generic-cli-agent",
  "status": "passed",
  "summary": "Phase 4 live generic agent smoke completed.",
  "findings": [],
  "evidence": [
    {
      "path": "raw.log",
      "description": "raw.log captures deterministic smoke-agent stdout."
    }
  ],
  "not_tested": [
    "Scheduler or background worker execution.",
    "External reviewer independence."
  ],
  "residual_risks": [
    "This proves the local generic-agent CLI path only."
  ],
  "generated_at": "2026-06-21T08:14:28Z"
}
